{
  "schemaVersion": "eden.process/v1",
  "name": "question",
  "command": "question",
  "coordinator": "monorepo-master",
  "input": "A read-only question about Eden.",
  "steps": [
    { "name": "route", "agent": "monorepo-master", "action": "Find the narrowest project owners in .agents/ownership.json.", "proof": "Every part of the question has an owner." },
    { "name": "inspect", "agent": "project-owner", "action": "Gather current evidence without changing state.", "proof": "Claims cite files, Nx metadata, or authoritative sources." },
    { "name": "answer", "agent": "monorepo-master", "action": "Synthesize one concise answer and expose uncertainty.", "proof": "The answer resolves the question without repository changes." }
  ],
  "proof": "The answer is evidence-backed and no state changed."
}
