{
  "schemaVersion": "eden.process/v1",
  "name": "feature",
  "command": "request",
  "coordinator": "monorepo-master",
  "input": "A requested user-visible or system capability.",
  "steps": [
    { "name": "locate", "agent": "monorepo-master", "action": "Map the request to Nx projects and owners.", "proof": "Affected projects and agents are named." },
    { "name": "define", "agent": "process-author", "action": "State the smallest outcome, acceptance evidence, and stop conditions.", "proof": "The slice can be observed failing before implementation." },
    { "name": "build", "agent": "project-owner", "action": "Implement independent slices in isolated worktrees.", "proof": "Each owner passes the narrowest Nx check." },
    { "name": "integrate", "agent": "monorepo-master", "action": "Combine the slices and remove superseded work.", "proof": "Affected Nx checks and review pass together." }
  ],
  "proof": "The requested capability works and its affected checks pass."
}
